1,Company,URL,Emp Count,Customer Problem & Solution (≈100 words),Key Technologies,Emp Count Source,Count Source Type
36,Visterra,visterrainc.com,79,"Visterra is a Cambridge-based biotechnology company that solves the problem of poorly targeted biologic drugs by engineering antibodies that hit the most functionally important spots on disease proteins. Its Hierotope® epitope-mapping platform integrates single-cell multiomics, structure-guided design, machine-learning analytics, and de novo protein engineering to discover and optimize mono- and multispecific antibodies with exceptional affinity, selectivity, and manufacturability. Because the molecules are precisely tuned, partners accelerate pipelines, cut costly clinical attrition, and bring transformative treatments to market faster for infectious disease, oncology, and metabolic disorders.",Hierotope® epitope mapping; AI-driven single-cell multiomics; de novo protein design; ViSTAR™ Fc modifications; multispecific antibody engineering,Not Specified,Not Specified
570,Gold Kidney,goldkidney.com,10,"Patients with advanced kidney disease often face fragmented dietary, medication, and lab-tracking regimens, leading to hospitalization. Gold Kidney’s remote monitoring service combines Bluetooth-scale weight, BP cuffs, and lab-data integrations into a single patient portal. AI flags deviations from individualized care plans, triggering nurse outreach. Health systems reduce readmissions by 25%, and patients maintain stability without frequent clinic visits.",IoT vitals integration; EMR-API lab feeds; patient-portal dashboard; AI risk-alert engine,,Multi 2dary
563,SulliVannyc,sullivannyc.com,12,"NYC professionals craving therapeutic haircare face one-size-fits-all salons that ignore scalp health. SulliVannyc’s micro-scalp-analysis, bespoke formula bar, and scalp-wellness protocols meld dermatology, trichology, and styling. A custom CRM tracks product regimens and stylist notes across visits, ensuring consistent, medically informed treatments that reduce breakage and improve retention. Clients solve chronic hair issues while enjoying high-end service in a private, wellness-focused studio.",Dermatology-grade scalp scanners; bespoke CRM; in-studio formulation lab; appointment-optimization AI,,Multi 2dary
37,Adelaide,adelaidemetrics.com,161,"Adelaide solves marketers’ inability to connect viewability metrics with business impact. AU, its omnichannel “attention unit,” is a machine-learning score calibrated to sales, foot traffic, and brand-lift outcomes. The system ingests thousands of contextual, creative, device, and behavioral signals for every impression across display, CTV, audio, social, and digital out-of-home within milliseconds. Advertisers plug AU into DSP bidding, planning dashboards, and post-campaign analytics to allocate spend toward inventory proven to drive incremental results. Publishers package high-AU placements to command stronger pricing, turning fragmented media-quality data into a single, outcome-linked currency that guides smarter investment decisions.",AU attention metric; real-time ML impression scoring; omnichannel measurement dashboard; programmatic custom bidding; outcome-based analytics,Not Specified,Not Specified
38,Blue Yonder,blueyonder.co.uk,8000,"Blue Yonder helps manufacturers, retailers, and logistics providers tame volatile global supply chains that bleed margin and frustrate customers. Its Luminate™ SaaS platform unifies demand sensing, inventory optimization, transportation, warehouse, and workforce planning in a single AI-orchestrated control tower. Predictive and generative models continuously ingest IoT, POS, telematics, weather, and social signals, automatically prescribing actions—rerouting freight, reallocating stock, adjusting prices, or re-sequencing labor—before disruptions hit. Users collaborate in context, track real-time KPIs, and simulate scenarios to balance service, cost, and sustainability targets, driving profitable growth.",Luminate™ SaaS; predictive & generative AI; demand-sensing algorithms; cognitive supply-chain planning; cloud microservices; IoT data ingestion,Not Specified,Not Specified
39,GSTV,gstv.com,139,"GSTV transforms the routine gas-station visit into a measurable, brand-safe advertising moment. A nationwide network of screens plays contextually relevant video while drivers fuel, delivering undivided attention just minutes from purchase. The OCTANE analytics suite stitches geospatial mobility traces, SKU-level transaction data, loyalty feeds, and digital behavior to build precise audiences and tie exposure to verified foot traffic and sales lift. Advertisers plan, activate, and optimize campaigns through self-serve or managed interfaces, while retailers monetize forecourt real estate without capital outlay. The solution converts commuter dwell time into performance marketing that is privacy-compliant and attributable.",OCTANE analytics; geospatial mobility datasets; SKU-level purchase integration; IoT screen network; foot-traffic attribution models,Not Specified,Not Specified
40,CrossCountry Consulting,crosscountry-consulting.com,554,"CrossCountry Consulting removes friction from finance, risk, and transaction activities for high-growth and mid-market companies. Its hybrid teams blend Big-Four technical depth with nimble, cloud-first delivery, deploying ERP, EPM, RPA, AI, and data-fabric accelerators to automate close, forecasting, and compliance processes. Strategic alliances with NetSuite, Workday, Coupa, OneStream, and Sage Intacct provide pre-configured blueprints, while proprietary analytics frameworks uncover insights for investors and executives. The firm also guides IPO readiness, ESG reporting, and full-lifecycle M&A carve-outs, ensuring clients achieve milestones without overstaffing internally, resulting in faster reporting, stronger controls, and confident decision-making.","Cloud ERP (NetSuite, Workday); RPA bots; AI analytics frameworks; data-fabric accelerators; ESG-reporting automation",Not Specified,Not Specified
41,Gresham Technologies,greshamtech.com,179,"Gresham Technologies eliminates operational risk and cost caused by inconsistent or siloed financial data. Its Control Cloud, Connect Cloud, Prime EDM, and Pulse Data modules automate ingestion, normalization, reconciliation, and regulatory reporting across trades, payments, and reference datasets in real time. Built on open APIs and high-performance rules engines, the platform delivers a single source of truth with full auditability and exception management, helping banks, asset managers, and fintechs meet compliance demands while reallocating staff to higher-value analysis and innovation.",Control Cloud rules engine; Connect Cloud messaging; Prime EDM data hub; real-time reconciliation; managed regulatory-reporting services,Not Specified,Not Specified
567,NewPage,newpage.io,20,"Digital teams struggle to prioritize features based on actual user behavior versus guesswork. NewPage embeds lightweight, no-code A/B testing and analytics directly into apps and websites, surfacing heatmaps, session replays, and conversion funnels without SDK bloat. A visual test-builder and AI insights accelerate learning loops—letting PMs and marketers validate 80% of hypotheses before engineering sprints, reducing wasted dev cycles and boosting release confidence.",No-code experiment builder; real-time event analytics; session-replay engine; AI test-recommendations,,Multi 2dary
42,Kennedy Community Health,kennedychc.org,310,"Edward M. Kennedy Community Health Center tackles healthcare inequity for 26 000 predominantly low-income, multilingual residents of Central Massachusetts. As a Federally Qualified Health Center, it unifies primary, dental, behavioral, pharmacy, and specialty care under one patient-centered medical home, coordinated through an advanced electronic health record and telehealth tools. Integrated social-service referrals, translation, LGBTQ+ programs, and substance-use treatment address social drivers of health. The integrated model reduces emergency-room dependence and chronic-disease disparities by delivering accessible, coordinated, culturally competent care where people live, work, and learn—regardless of ability to pay.",Epic EHR; telehealth platform; population-health analytics; NCQA PCMH workflows; integrated behavioral-health tech,Not Specified,Not Specified
43,Thorlux Lighting,thorlux.co.uk,253,"Thorlux Lighting enables commercial and industrial facilities to slash energy costs and carbon emissions without sacrificing visual comfort. Its LED luminaires embed SMART Sensors that blend presence detection, maintained-illuminance algorithms, daylight harvesting, and Motionline group communication to dim or switch off lights automatically. Web dashboards provide real-time monitoring and analytics, guiding further efficiency upgrades and compliance reporting. The modular system retrofits quickly in warehouses, factories, hospitals, or tunnels, delivering safer, smarter, lower-cost illumination through technology-enabled control and insight across large portfolios.",SMART Sensor presence detection; Motionline networking; daylight-harvesting algorithms; LED-driver dimming electronics; energy-monitoring dashboard,Not Specified,Not Specified
45,Esperion Therapeutics,esperion.com,304,"Esperion Therapeutics provides convenient oral solutions for patients needing additional LDL-cholesterol reduction beyond statins. Its proprietary ETC-1002 prodrug platform created bempedoic acid, an ACL inhibitor activated only in the liver, avoiding muscle side effects common with statins. Fixed-dose combinations with ezetimibe deliver greater lipid lowering, and the CLEAR Outcomes cardiovascular-events trial validates long-term benefit. Pipeline research explores triple therapies and metabolic-disease indications, all leveraging Esperion’s chemistry, manufacturing, and regulatory expertise. Clinicians gain a tolerable, once-daily option; payers gain cost-effective risk reduction; and patients gain improved adherence and cardiovascular protection without injections or frequent laboratory monitoring.",ETC-1002 prodrug chemistry; bempedoic-acid ACL inhibition; fixed-dose combination formulation; CLEAR Outcomes analytics; scalable oral manufacturing,Not Specified,Not Specified
80,Fannie Mae,fanniemae.com,"8,200","Community lenders can’t hold long-term fixed-rate mortgages on balance sheets. Fannie Mae purchases and securitizes conforming loans, injecting daily liquidity so banks can keep originating and borrowers lock affordable rates. Sophisticated risk-pricing, credit-risk transfer, and MBS analytics stabilize the $13 Tn housing market and expand access for first-time and low-income buyers.",Desktop Underwriter AUS; MBS debt-issuance & pricing engines; credit-risk-transfer analytics; Servicing Marketplace APIs; ESG loan-level data feeds,Macrotrends,1 public source
81,Nue,nue.io,100,"SaaS CFOs wrestle with tangled CPQ, billing, and usage-mediation tools that slow launches and revenue recognition. Nue’s Salesforce-native quote-to-revenue platform unifies price-builder, guided selling, subscription/usage billing, and RevRec in a single data model, letting RevOps teams deploy new tiers, PLG checkout, or hybrid contracts in minutes without code. Finance gains real-time ARR and ASC 606 compliance; sellers close deals faster with one workflow.",Salesforce-native CPQ engine; multi-attribute price builder; real-time usage metering; ASC 606 RevRec automation; analytics in CRM,CPQ Integrations,1 public source
571,Evergreen Nephrology,evergreennephrology.com,30,"Dialysis providers and CKD patients juggle treatment schedules, lab results, and dietary guidance across disconnected systems. Evergreen Nephrology offers a clinic network and telehealth suite where nephrologists, dietitians, and social workers share a unified care-management platform. Automated appointment reminders, remote-lab ordering, and patient-education modules improve adherence and quality metrics, reducing hospitalizations and keeping patients closer to home.",Unified EHR; tele-nephrology portal; lab-ordering integration; care-plan dashboards; engagement modules,,Multi 2dary
566,Ubicquia,ubicquia.com,35,"Cities investing in smart streetlights face fragmented sensor ecosystems that hinder actionable insights. Ubicquia’s “Ubicell” retrofit modules attach to existing poles, combining environmental, acoustic, and connectivity sensors on a single platform. Data streams into a cloud dashboard that monitors air quality, noise violations, and public-WiFi—all on shared-power infrastructure. Municipalities deploy fully featured “smart poles” without ripping out luminaires, saving capex and unlocking cross-departmental analytics.",Multi-sensor edge nodes; NB-IoT/LTE backup; PoE connectivity hub; cloud-native analytics portal,,Multi 2dary
82,BODi (Beachbody Company),bodi.com,355,"Millions start fitness programs but quit for lack of structure and accountability. BODi curates 130+ streaming workout series, nutrition plans, and mindset coaching in an all-access subscription. Live-interactive classes, AI-based workout recommendations, and integrated meal tracking keep users engaged longer than static videos, driving measurable weight-loss and wellness outcomes without gym trips.",Personalized video platform; live interactive classes with heart-rate telemetry; macro-tracking meal app; AI program recommender; e-commerce supplement stack,StockAnalysis,1 public source
83,Cloudfy,cloudfy.com,100,"Manufacturers and wholesalers often bolt generic e-commerce on ERP, spawning manual order re-keying and channel conflict. Cloudfy offers a SaaS B2B commerce suite pre-integrated to SAP, Epicor, NetSuite, Sage X3 and supports complex price books, punch-out, and bulk ordering out-of-the-box. Clients launch portals in weeks, cut call-center costs, and lock in digital-first buyers without custom builds.",Headless B2B storefront engine; pre-built ERP connectors; PunchOut2Go gateway; progressive web-app ordering; AI stock & lead-time estimator,LinkedIn,1 public source
84,Gindin Consulting,gindinconsulting.com,1,"Mid-size financial firms lack in-house expertise to harden networks and pass stringent SOC2/FFIEC audits. Gindin Consulting’s solo principal delivers fractional CISO guidance, BCP/DR redesign, and zero-trust network architectures, giving clients senior-level security leadership without full-time overhead.",NIST 800-53 compliance mapping; vendor-risk scoring sheets; AWS/Azure identity hardening scripts; tabletop DR facilitation,gindinconsulting.com,1 public source
85,AVIA Health Innovation,aviahealth.com,36,"Health-system executives face innovation overload—thousands of point solutions, uncertain ROI. AVIA curates a peer network, market-scans digital vendors, and runs rapid-cycle collaboratives so members share due-diligence costs and deploy proven tech faster. Advisory sprints map economics, workflows, and change-management playbooks, accelerating digital-front-door, virtual-care, and AI initiatives.",AVIA Nexus knowledge-graph; vendor-scoring database; collaborative ROI calculators; secure benchmarking portal,Datanyze,1 public source
86,activpayroll,activpayroll.com,281,"Multinational companies juggle dozens of local payroll bureaus, risking compliance fines and over-payments. activpayroll consolidates 150-country payroll, mobility tax, and expatriate services on a single ISO-27001 platform with real-time statutory updates and API hooks to SAP, Workday, and HRIS. Global HR gains one SLA, one dashboard, and assured compliance.",Activ8 global payroll engine; statutory rules library; mobility tax calculator; HRIS integration APIs; analytics on gross-to-net variances,LeadIQ,1 public source
561,Bora Biologics US,borabiologics-us.com,50,"Early-stage manufacturers of biologics struggle with small-batch clinical GMP production due to high minimums and long lead times. Bora Biologics offers fully licensed, multi-product bioreactors and downstream suites at 50L–200L scale, plus analytical support. Their open-access scheduling and quality-by-design workflows let innovators run IND-enabling batches in weeks, not months, without building in-house facilities—accelerating go/no-go decisions and conserving capital.",Single-use bioreactors; ion-exchange chromatography; inline PAT analytics; digital LIMS integration,,Multi 2dary
569,Tug Agency,tugagency.com,50,"Brands struggle to balance creative storytelling with performance marketing. Tug’s integrated team of strategists, designers, and data scientists builds conversion-optimized creatives at scale, using rapid-iteration labs and ad-tech integrations. Their “Creative OS” automates asset adaptation across 50+ formats and dynamically injects personalized elements, driving +20% CTR and +15% ROAS compared to static campaigns—without losing brand consistency.",Creative-automation engine; ad-tech connectors; real-time performance APIs; personalization modules,,Multi 2dary
87,Priority Technology Holdings,prth.com,983,"ISOs and ISVs need omni-channel payments, ACH, and merchant-cash-advance without stitching multiple vendors. Priority’s cloud stack bundles card acquiring, PayFac rails, and back-office treasury into white-label APIs, giving partners instant scale and Net-settle funding, while merchants get unified reporting and working-capital offers.",MX™ merchant platform; PayRight Gateway; real-time API settlement; data-driven MCA underwriting; PCI-Level 1 cloud,StockAnalysis,1 public source
88,Acquco,acqu.co,150,"Amazon FBA founders who want liquidity face opaque brokers, long earn-outs, and brand dilution. Acquco offers tech-enabled 30-day exits with performance-based upside: AI scrapes Seller Central, models TACoS and working-capital needs, then funds acquisition and growth, letting entrepreneurs retain minority stakes.",Marketplace due-diligence AI; dynamic SKU repricing; supply-chain forecasting engine; programmatic ads optimizer; multi-storefront OMS,LinkedIn,1 public source
89,Rakuten Group,rakuten.com,"32,000","Merchants and consumers seek rewards across e-commerce, fintech, and telecom silos. Rakuten unifies loyalty, payments, banking, and marketplace services on a single ID, turning cross-business data into personalized cashback, ads, and fintech offers that raise LTV. Its mobile-native ecosystem now spans 70+ businesses globally.",Rakuten ID graph; SixthSense AI CX engine; Rakuten Pay super-app; Viber communications layer; cloud Open RAN mobile network,Reuters,1 public source
90,Intercept Pharmaceuticals,interceptpharma.com,341,"Patients with rare liver diseases have limited oral options once first-line treatments fail. Intercept discovered obeticholic acid—the first FXR agonist approved for PBC—and is advancing next-gen fixed-dose combos and fibrosis candidates. Its regulatory, supply-chain, and PSP infrastructure help hepatologists start and monitor therapy quickly, improving outcomes in high-unmet-need populations.",FXR ligand design platform; real-world safety registry; specialty-pharmacy PSP portal; scalable small-molecule manufacturing,Tracxn,1 public source
91,Virgin Group,virgin.com,"71,000","Scale-ups in travel, telecom, health, and space need global brand trust and cross-sector synergies they can’t build alone. Virgin licenses its iconography, customer-service IP, and investment muscle to joint-ventures, injecting instant credibility and experience that accelerates market entry while sharing downside risk.","Virgin Red super-loyalty app; brand‐licensing frameworks; group shared-services (CX, sustainability); Virgin Innovations venture platform",Wikipedia,1 public source
93,Choreograph (WPP),choreograph.com,900,"Marketers drowning in fragmented IDs, cookies, and clean-room pixels can’t build durable audience strategy. Choreograph stitches advertiser, publisher, and retail data through privacy-safe collaboration tech, layered with AI modeling, to plan, activate, and optimize media across GroupM at global scale—turning “data exhaust” into deterministic lift.",InfoSum privacy mesh; Alive ID deterministic graph; AI geospatial & agentic-AI models; Open Media Studio APIs; real-time planning UI,LinkedIn,1 public source
94,RJM Advisors,rjmadvisors.com,10,"Mid-market brands often deploy costly MarTech but still lack CRM strategy that drives lifetime value. RJM Advisors delivers fractional CRM leadership—audits data, designs automated journeys, and stands up loyalty analytics—so companies convert dormant lists into growth without adding permanent headcount.",HubSpot/Salesforce orchestration; CDP segmentation blueprints; trigger-based email/SMS flows; KPI scorecards,rjmadvisors.com,1 public source
95,Meganexus,meganexus.com,100,"Justice, health, and community agencies juggle legacy case-management tools that can’t share data securely. Meganexus’ secure SaaS modules (CAPTR, COMPLY, GENAIE) give front-line staff a single view of citizens, action plans, and outcomes while meeting MoJ, NHS, and GDPR standards, reducing re-offending and administrative overhead.",ISO-27001 cloud; role-based portals; form-builder workflow engine; analytics dashboard; Azure hosting with CI/CD,LeadIQ,1 public source
96,Spaculus Software,spaculus.com,50,"SMEs need custom AI and web apps but can’t afford big-firm rates. Spaculus offers ISO-9001/27001 full-stack dev squads that craft ML, mobile, and SaaS products on fixed-bid sprints, helping clients modernize workflows without growing in-house engineering.",React/Flutter stacks; Azure/GCP cloud migration; GPT-powered chatbots; automated test pipelines; DevSecOps tool-chain,Craft.co,1 public source
97,Osome,osome.com,389,"Entrepreneurs waste days on incorporation, bookkeeping, and multi-country compliance. Osome’s AI-assisted platform pairs human accountants with automated document recognition, reconciliation, and e-sign flows to deliver live financial dashboards, tax filings, and payroll across SG, HK, and UK—so founders focus on growth, not admin.",OCR & doc-classification AI; multi-ledger bookkeeping engine; cross-border e-signature & bank feeds; chat-first client app; API-ready tax filing,LeadIQ,1 public source
98,Heartbeat (Publicis Health),weareheartbeat.com,250,"Challenger pharmaceutical brands lack the budgets and data access enjoyed by “big-pharma” incumbents. Heartbeat’s full-service agency fuses digital-first creative, omnichannel media, and data science to pinpoint niche HCP and patient micro-segments, turning limited spend into disruptive launch momentum that changes prescribing behavior.",Proprietary patient graph “CMD”; multivariate content CMS; AI creative-testing lab; privacy-safe HCP targeting DSP; outcomes-based media models,LeadIQ,1 public source
99,AVEO Oncology,aveooncology.com,150,"Oncologists treating refractory renal-cell carcinoma need VEGF therapy options with better tolerability. AVEO’s tivozanib (FOTIVDA) provides potent, highly selective VEGFR inhibition with a favorable safety profile and is supported by combination and next-line trials. AVEO’s LG Chem backing secures manufacturing and R&D scale, giving clinicians viable options after IO/IO failure.",Structure-based kinase design; real-world data registry; specialty pharmacy distribution; phase III/IV trial network,LeadIQ,1 public source
116,Marmon Aerospace & Defense,marmon-ad.com,73,"Defense primes need cables that endure hypersonic flight, deep-sea pressure and space radiation. Marmon’s Berkshire-Hathaway-owned plants design and build custom fluoropolymer, RF and fiber assemblies, then validate them in AS9100 test labs. By bundling engineering, rapid prototyping and low-rate production under one roof, programs avoid multi-vendor delays and qualify faster, cutting program risk and lifecycle cost.",Radiation-resistant fluoropolymer jacketing; automated concentric lay stranding; laser-etched UID marking; AS9100 EMI/thermal labs; ERP-linked digital traveler,Not Specified,Not Specified
565,Servita,servita.com,150,"Healthcare operators must juggle patient transport, medical devices, and home-health staffing, often via disparate vendors. Servita offers a unified logistics and staffing platform for DME delivery, non-emergency transport, and in-home care scheduling. An AI dispatcher optimizes routes and staffing based on patient acuity, while a mobile app provides ETA and status updates. Providers cut no-shows by 30% and patients gain transparency, reducing administrative burden and improving care continuity.",AI routing & staffing engine; DME inventory tracker; mobile patient app; telematics integration,,Multi 2dary
120,Jebbit,jebbit.com,59,"Marketers losing third-party cookies need zero-party data and engaging UX. Jebbit’s no-code builder lets brands launch personality quizzes, product-finders and shoppable lookbooks in minutes, capturing declared preferences that sync instantly to CDPs and ESPs. Completion rates top 85%, driving higher ROAS and personalization without privacy headaches.",Drag-and-drop experience builder; real-time CDP sync; template library; AI quiz recommendations; mobile-first embeds,Not Specified,Not Specified
76,Pareto Intelligence,paretointel.com,175,"Health plans struggle to unify siloed claims, clinical, and SDoH feeds fast enough to win value-based contracts. Pareto’s cloud platform ingests billions of rows nightly, applying patented AI risk-adjustment, gap-closure, and leakage models that surface under-coded conditions and missed revenue within hours. Interactive workboards let providers validate evidence, trigger member outreach, and reconcile payments, delivering 5-20× ROI and measurable quality gains without standing up huge data teams.",HIPAA-secure lakehouse; ML risk-scoring algorithms; “AU” data fabric; NLP chart-mining; FHIR APIs for real-time writes to EMRs,Growjo,Multi 2dary
