607,Frontier BPM,frontierbpm.com,400,"Contact centers juggling multiple platforms suffer long hold times and inconsistent agent experiences. Frontier BPM unifies telephony, CRM, and workforce-management into a single cloud ACL, applying ML-driven call-routing and sentiment analytics to staff the right agent at the right time. Real-time supervisors can intervene with whisper/coaching tools, boosting CSAT and reducing AHT without ripping out existing infrastructure.",Cloud contact-center platform; ML call-routing; sentiment-analytics; workforce-management UI,Multi sources,Quick Est GPT-o3
638,IGEL,igel.com,400,"Enterprises migrating to hybrid work struggle with endpoint sprawl and security gaps. IGEL’s Linux-based OS transforms PCs into secure thin clients managed centrally. Integrated zero-trust access, WAN optimization, and multi-session virtualization reduce endpoint TCO while enforcing compliance policies across 50+ VDI and DaaS platforms.",Linux thin-client OS; zero-trust gateway; endpoint management console; virtualization support,Multi sources,Quick Est GPT-o3
768,Eurochange,eurochange.co.uk,400,"Travelers and expatriates face high FX fees and poor rates at airport kiosks. Eurochange’s omnichannel bureau-de-change platform offers interbank rates via online, kiosk, and branch channels. Real-time rate-alerts, dynamic pricing algorithms, and mobile order-ahead reduce cost by up to 30%. Automated reconciliation and PCI-compliant settlement dashboards streamline treasury operations for corporate clients, while retail users enjoy guaranteed rates on pickup.",Dynamic FX-pricing engine; omnichannel ordering platform; rate-alert APIs; settlement dashboards,Multi sources,Quick Est GPT-o3
771,1E,1e.com,400,"Global enterprises struggle to manage software distribution, OS-patch compliance, and energy waste across millions of endpoints. 1E’s Empirum and Tachyon platforms automate real-time software delivery, patch orchestration, and live remediation workflows. Integrated endpoint analytics and power-management modules reduce carbon footprint and security risk without impacting user productivity—delivering both cost savings and sustainability gains at scale.",Real-time patch orchestration; software delivery bus; endpoint analytics; power-management module,Multi sources,Quick Est GPT-o3
804,PerfectServe,perfectserve.com,400,"Healthcare providers fragment schedules across EHRs, phone systems, and pagers, causing delayed responses and care coordination failures. PerfectServe’s care-communication platform unifies on-call schedules, secure messaging, and escalations in one mobile/web interface. Intelligent routing ensures critical messages reach the right clinician based on criteria (role, location, availability), reducing response times by 50% and improving patient safety without new infrastructure.",Role-based routing engine; secure-messaging APIs; schedule-integration adapters,Multi sources,Quick Est GPT-o3
842,Ellkay,ellkay.com,400,"Healthcare organizations integrating multiple EMRs and lab systems face costly, manual interfaces that delay data flow. Ellkay’s interoperability platform provides pre-built, secure connectors for 3,200+ labs and devices, transforming HL7, FHIR, and proprietary formats into standardized streams. Real-time monitoring and error-correction dashboards ensure data integrity across patient care and population-health analytics, eliminating custom interface projects and accelerating go-live.",Interoperability hub; HL7/FHIR connectors; real-time monitoring; error-correction engine,Multi sources,Quick Est GPT-o3
960,Stratus Technologies,stratus.com,400,"Manufacturers and critical-uptime operations lose millions when even seconds of downtime occur on production lines. Stratus provides fault-tolerant servers and software, combined with its ztC Edge appliance, to deliver “always-on” virtualization and industrial-IoT applications. Integrated health-monitoring, automated failover, and remote update orchestration ensure control systems and OT workloads run continuously without complex clustering or manual intervention—keeping plants running and SLAs intact.",Fault-tolerant hardware; integrated virtualization; health-monitoring dashboard; automated failover,Multi sources,Quick Est GPT-o3
114,Pension Protection Fund (PPF),ppf.co.uk,405,"When a UK sponsor of a defined-benefit plan collapses, retirees risk losing lifelong income. The statutory PPF steps in as “lifeboat,” pooling levies, insolvency recoveries and £32 billion in assets to guarantee 100% or 90% of accrued pensions. Sophisticated ALM, ESG screens and liability-driven hedging keep the fund 137% funded while the levy falls to a record £45 million, easing pressure on solvent employers. Members gain certainty and continuity without taxpayer bail-outs.",ALM risk-hedging engine; 7800 index stress tests; ESG stewardship analytics; digital self-service portal; insolvency-score API,Multi sources,Quick Est GPT-o3
584,Relm Insurance,relminsurance.com,45,"Small businesses face rising liability and property premiums but lack underwriting data to negotiate better rates. Relm underwrites based on real-time asset sensors and operational telemetry (e.g., IoT water-flow meters, security cameras), adjusting premiums dynamically. Clients get lower, more accurate pricing and proactive risk alerts that prevent losses—turning insurance from cost center into a risk-management tool.",IoT risk-sensor integration; dynamic-pricing engine; real-time underwriting APIs; loss-alert portal,Multi sources,Quick Est GPT-o3
605,ARO (US),aro.co.uk,45,"Small-fleet operators and independent garages lack digital post-repair inspection and service-reminder tools, causing lost upsell opportunities and compliance gaps. ARO’s mobile inspection app, barcode-linked parts catalog, and cloud-dashboard automate service quotes, safety-checks, and follow-ups. Customers receive video-proof reports and automated reminders, boosting retention and average-repair-value without extra admin.",Mobile VHC app; barcode-parts integration; cloud CRM dashboard; automated reminder engine,Multi sources,Quick Est GPT-o3
633,FundingXchange,fundingxchange.co.uk,45,"UK SMEs struggle with opaque lending options and lengthy applications. FundingXchange’s digital marketplace matches businesses to 40+ lenders via API, using credit-modeling and risk-scoring to generate instant term sheets. Automated documentation and e-signing speed completions, giving SMEs choice, transparency, and faster access to working-capital without heavy broker fees.",Marketplace-matching engine; credit-scoring ML; API lender connectors; e-sign workflows,Multi sources,Quick Est GPT-o3
658,UnioHP,uniohp.com,45,"Aging public housing stock needs robust health checks, maintenance, and resident engagement. UnioHP’s platform schedules inspections, logs defects with mobile cameras, and auto-prioritizes workorders based on risk and compliance. Integrated tenant portals let residents submit issues and track progress, improving satisfaction and reducing reactive repair costs by 30% across housing associations.",Mobile inspection app; risk-prioritization engine; tenant engagement portal; compliance tracking,Multi sources,Quick Est GPT-o3
675,Fitcy Health,fitcyhealth.com,45,"Health plans and employers struggle to engage members in preventive care and healthy behaviors. Fitcy Health’s mobile-first wellness platform delivers gamified challenges, personalized coaching, and biometric tracking. Integrated EHR and device APIs sync labs and wearables, while AI nudges drive habit formation. Employers see reduced medical-trend and improved workforce productivity without building their own wellness apps.",Gamification engine; AI coaching algorithms; EHR & wearable integrations; real-time engagement dashboard,Multi sources,Quick Est GPT-o3
734,Gear4Music,gear4music.com,450,"Musicians and educators face fragmented online catalogs and inconsistent product info. Gear4Music’s e-commerce platform centralizes 25,000+ musical instruments and gear, enriched with expert reviews, video lessons, and AR try-before-you-buy. Integrated logistics and drop-ship APIs deliver fast shipping, while data-driven merchandising dashboards optimize inventory and personalized recommendations that boost AOV and reduce returns.",Product enrichment CMS; AR-preview module; drop-ship API integrations; merchandising analytics,Multi sources,Quick Est GPT-o3
514,Francis Brown Ltd,francis-brown.com,46,"High-pressure vessels for nuclear, hydrogen and renewables demand zero weld failures. Francis Brown fabricates, machines and tests ASME-coded assemblies under one Teesside roof, giving EPCs schedule certainty and lifetime traceability. LinkedIn","5-axis heavy CNC, ASME IX welding, robotic NDT, ERP-linked QA docs, in-house hydro-test 1000 bar",Multi sources,Quick Est GPT-o3
513,Vet4U Rx,vet4urx.com,50,"SDVOSB Vet4U Rx supplies federal buyers with medical and industrial products, navigating VA contracts most vendors cannot. Its e-commerce and compliance team simplify procurement while boosting veteran-owned spend targets.","FedMall-ready catalog, SAM/VA‐verified workflows, punch-out API, GSA price-tracking tool, SDVOSB reporting",Multi sources,Quick Est GPT-o3
585,AvAir Pros,avairpros.com,50,"MRO providers and OEMs struggle to track aerospace parts through complex multi-tier supply chains. AvAir Pros supplies a digital marketplace of certified spares with end-to-end lot, serial, and maintenance-event traceability. Their blockchain-backed provenance ledger and automated compliance checks accelerate repairs and reduce grounded-aircraft time, ensuring airlines and maintenance shops keep fleets flying cost-effectively.",Blockchain provenance ledger; parts-marketplace API; compliance-automation engine; traceability portal,Multi sources,Quick Est GPT-o3
612,TuringSaaS,turingsaas.com,50,"Selling digital-native SaaS often leaves vendors with manual billing, renewals, and revenue-recognition headaches. TuringSaaS automates subscription management, proration, and ASC 606 compliance across Stripe, Zuora, and Netsuite. Their webhooks-driven workflow engine triggers usage-tiers and mid-cycle changes in real time, while dashboards give finance teams complete close-to-cash visibility—eliminating spreadsheet chaos without custom code.",Subscription-billing automation; webhook orchestrator; proration engine; close-to-cash dashboards,Multi sources,Quick Est GPT-o3
627,Sundai,sundai.us,50,"Non-profits and educational institutions struggle to manage donor impact and program outcomes separately. Sundai’s all-in-one platform integrates CRM, case-management, and impact-reporting tools. Automated KPI dashboards and grant-application wizards help teams allocate resources and demonstrate outcomes to funders in a single portal, reducing manual data aggregation and boosting grant success rates.",CRM with case-management; impact-analytics dashboards; grant-wizards; API integrations,Multi sources,Quick Est GPT-o3
639,ParkTX,parktx.com,50,"Municipalities and campus operators struggle to monetize parking assets without intrusive kiosks. ParkTX provides curb-to-curb mobile payments, dynamic pricing, and occupancy sensing via LPR cameras and IoT meters. Real-time analytics dashboards optimize rates, permit management, and enforcement workflows—boosting revenue and reducing congestion without new hardware investments.",LPR-IoT sensors; dynamic-pricing engine; mobile-pay SDK; enforcement portal,Multi sources,Quick Est GPT-o3
661,Movn Health,movnhealth.com,50,"Senior-care operators struggle to coordinate care across home health, Hospice, and skilled nursing, leading to gaps and readmissions. Movn Health’s digital platform integrates patient referrals, care-plan authorizations, and home-visit scheduling into one workflow. AI-driven risk flags and mobile clinician apps ensure care teams act on critical changes sooner—improving transitions and reducing 30-day readmissions by 20%.",Referral orchestration; AI risk-flag engine; mobile clinician app; unified care workflow,Multi sources,Quick Est GPT-o3
691,EsyaSoft,esyasoft.com,50,"Construction and engineering firms juggle project schedules, subcontractor compliance, and cost tracking across disconnected tools, leading to overruns. EsyaSoft’s integrated ERP-PM platform unifies Gantt planning, subcontractor onboarding, equipment logistics, and change-order workflows. Real-time dashboards highlight schedule risks and cost variances, while mobile field apps capture time and materials data on site. The result: tighter project control, fewer disputes, and on-time delivery without manual spreadsheet massaging.",ERP-PM unified platform; Gantt-analytics dashboards; subcontractor-compliance module; mobile field app,Multi sources,Quick Est GPT-o3
710,ShareOne,shareone.com,50,"Retailers and hospitality chains struggle to manage multi-vendor loyalty schemes, gift cards, and promotions separately, leading to operational headaches and poor customer engagement. ShareOne’s loyalty-as-a-service platform unifies points, e-vouchers, and promotion triggers under one API. Real-time balance checks, integrated CRM workflows, and customizable reward catalogs let brands launch and adjust programs in days, boosting repeat spend and simplifying back-office reconciliation.",Loyalty-as-a-service API; real-time balance engine; CRM connector library; reward catalog manager,Multi sources,Quick Est GPT-o3
730,RanchoMed,ranchomed.com,50,"Rural Californians often forgo preventive screenings and speciality care due to travel barriers. RanchoMed’s virtual-first clinic offers telehealth visits, mobile lab draws, and prescription delivery. Integrated patient portal and remote monitoring devices feed into a unified EHR, enabling continuous care and data analytics-driven outreach that catches chronic-disease exacerbations early—reducing ER visits and improving population health in underserved areas.",Telehealth & remote monitoring; mobile lab-draw coordination; integrated EHR; patient-portal analytics,Multi sources,Quick Est GPT-o3
754,Network Distribution,networkdistribution.com,50,"Retailers expanding into new regions struggle to locate and onboard reliable wholesale distributors. Network Distribution’s marketplace matches retailers with pre-vetted distributors based on inventory coverage, credit terms, and delivery speed. Real-time order-routed TMS and EDI integrations automate order flow, while performance dashboards track fill-rate and on-time delivery—enabling retailers to scale assortment quickly without manual outreach.",Marketplace matching engine; TMS/EDI connectors; performance dashboards; credit-scoring API,Multi sources,Quick Est GPT-o3
766,Clarest,clarest.com,50,"Healthcare payers and providers juggle multiple pharmacy benefit managers and formulary rules, leading to claim denials and treatment delays. Clarest’s real-time formulary-and-benefit API ingests member eligibility, step-therapy protocols, and copay tiers to surface lowest-cost prescriptions at point-of-care. Integrated override-workflow tools and analytics dashboards reduce prior-auth burdens by 60% and accelerate patient access to therapies without manual benefit lookups.",Real-time formulary API; step-therapy engine; override workflows; benefit analytics dashboards,Multi sources,Quick Est GPT-o3
788,Agama.ai,agama.ai,50,"Telecom operators managing multi-vendor radio and core networks lack unified performance analytics. Agama.ai’s AI platform ingests network probes, CDRs, and OSS events, applying unsupervised learning to detect anomalies, capacity issues, and fraud. Interactive topology maps and root-cause workflows enable rapid troubleshooting, while predictive-capacity planning avoids congestion—improving QoE and reducing churn without siloed-tools integration.",AI analytics engine; multi-vendor probe integration; unsupervised anomaly detection; topology mapping,Multi sources,Quick Est GPT-o3
807,Red Rock,red-rock.com,50,"Property operators and investors need reliable sourcing for mid-scale hospitality and multifamily acquisitions. Red Rock’s data-driven brokerage platform aggregates off-market listings, applies proprietary valuation models, and automates LOI and DD workflows. Real-time alerts on comp movements and cap-rate shifts help clients execute quickly, reducing reliance on fragmented broker networks and improving deal certainty without custom data pipelines.",Off-market data-aggregation; valuation-model engine; LOI/DD workflow; alert dashboards,Multi sources,Quick Est GPT-o3
824,Gib UK,gibuk.com,50,"UK SMEs struggle with fragmented business insurance offerings and poor digital servicing. Gib UK’s cloud-native brokerage platform aggregates multiple insurers’ products, powering instant quotes, binding, and claims management through one portal. Automated risk-profiling and tailored policy recommendations ensure the right cover at competitive rates. Integrated client dashboards and renewal-reminder workflows reduce churn and administrative burden, while API integrations feed risk data into clients’ ERP and accounting systems—delivering a seamless end-to-end commercial insurance experience.",Aggregation API; risk-profiling engine; digital-binding workflows; client dashboard; renewal automation,Multi sources,Quick Est GPT-o3
844,Arthritis Canada,arthritis.ca,50,"Canadians living with arthritis need reliable information, community support, and advocacy but face fragmented resources. Arthritis Canada’s digital hub centralizes educational content, self-management tools, and support-group matchmaking. Integrated tele-health webinars, symptom-tracking apps, and research registries empower patients and clinicians with data-driven insights—improving quality of life and accelerating advocacy efforts.",Patient portal; symptom-tracking app; community-match engine; tele-health webinar platform,Multi sources,Quick Est GPT-o3
861,Lloyd Whyte,lloydwhyte.com,50,"Financial institutions face complex data sourcing, compliance, and analytics for asset classes. Lloyd Whyte provides a consolidated financial-data platform with standardized data feeds, regulatory-reporting modules, and research-analytics workbenches. APIs deliver clean, normalized time series and reference data directly into risk models, reducing data-engineering burden and speeding go-live for trading and risk-management systems.",Data-normalization engine; regulatory-reporting modules; API data feeds; analytics workbench,Multi sources,Quick Est GPT-o3
903,Rational Enterprise,rationalenterprise.com,50,"Enterprises grapple with disconnected enterprise risk-management (ERM) tools and manual processes. Rational Enterprise’s SaaS ERM platform centralizes risk registers, control frameworks, and incident reporting with workflow automation. Integrated heat maps and KRIs provide real-time visibility, while API connectors sync with GRC, finance, and audit systems—enabling proactive risk mitigation and regulatory compliance without spreadsheet chaos.",ERM workflow engine; risk-heat maps; KRI dashboards; API connectors,Multi sources,Quick Est GPT-o3
949,Loyalty.com,loyalty.com,50,"Brands and retailers need configurable loyalty programs but lack technical resources to build robust systems. Loyalty.com’s SaaS platform offers point, tier, and event-based loyalty rules, omnichannel redemption, and real-time customer dashboards. API connectors to POS and e-comm systems streamline integration, while gamification and personalized offers drive engagement without custom development.",Loyalty-rules engine; omnichannel redemption; POS/e-comm connectors; customer-dashboard analytics,Multi sources,Quick Est GPT-o3
604,nhs.net,nhs.net,500,"NHS trusts need secure, NHS-approved email and collaboration for patient data and governance, but commercial platforms lack necessary accreditation. The nhs.net service provides encrypted email, calendar, and file-share under ISO 27001 and NHS IG toolkit compliance, integrated with smartcard authentication. Trusts connect regional hubs seamlessly, ensuring clinicians exchange sensitive data safely without managing bespoke on-prem systems.",Encrypted messaging; smartcard SSO; ISO-27001 email servers; IG toolkit compliance dashboards,Multi sources,Quick Est GPT-o3
634,Claxton Engineering,claxtonengineering.com,500,"Oil & gas operators need rapid turnarounds on chemical processing skids and modular units. Claxton’s EPC-plus model delivers integrated design, fabrication, and skid-assembly under one roof, using 3D CAD tooling and modular construction workflows. On-site installation teams leverage digital twins for commissioning, reducing startup times and field rework in high-hazard facilities.",3D CAD & digital-twin; modular fabrication; ERP-linked scheduling; commissioning suite,Multi sources,Quick Est GPT-o3
826,BarkBox (Bark),barkbox.com,500,"Pet parents want engaging, safe, and convenient ways to spoil dogs without the hassle of sifting through countless products. BarkBox curates monthly subscription boxes of toys, treats, and chews tailored by dog size and preferences. A data-driven recommendation engine learns each pup’s likes and dietary needs, reducing returns and increasing satisfaction. Integrated community features and a mobile app streamline orders and provide training tips—delivering delight to pets and predictability for owners via one subscription.",Subscription-commerce engine; personalization algorithm; mobile app; community engagement platform,Multi sources,Quick Est GPT-o3
900,Quickbase,quickbase.com,500,"Business teams need custom applications to track processes, but traditional development is slow and costly. Quickbase’s low-code platform provides drag-and-drop app building, automated workflows, and pre-built templates. Real-time dashboards and relationship modeling let users iterate rapidly and integrate with SaaS tools via connectors—delivering process apps in days, not months, without full-stack development.",Low-code app builder; workflow automation; pre-built templates; API connectors,Multi sources,Quick Est GPT-o3
911,MFS Admin,mfsadmin.com,500,"Asset managers and fund administrators face complex onboarding, compliance, and NAV calculations across global strategies. MFS Admin’s SaaS platform centralizes fund-accounting, investor reporting, and risk analytics with automated reconciliations and regulatory templates. Integrated dashboards provide real-time NAV and performance metrics—reducing manual processes and improving transparency for CIOs and investors without bespoke fund-admin builds.",Fund-accounting engine; reconciliation automation; NAV dashboard; compliance templates,Multi sources,Quick Est GPT-o3
499,Freefolk,freefolk.com,60,"Brands and streamers need cinema-grade VFX on TV budgets. Freefolk’s London-NY studios blend senior Flame/Nuke artists, Houdini CG and GPU render-farm orchestration to deliver photoreal creatures, de-aging and virtual production assets in half the usual schedule. Integrated colour, finishing and QC mean fewer hand-offs, while real-time UE previs lets directors lock shots on set—cutting reshoot risk and post spend.","Houdini FX, Nuke/Flame comp, 100 Gb GPU render-farm, Unreal Engine virtual production, remote-review platform",Multi sources,Quick Est GPT-o3
632,Guardian Smith,guardiansmith.com,60,"High-net-worth families and executives need robust personal-security and intelligence services. Guardian Smith’s subscription combines 24/7 secure communication app, vetted ground teams, and threat-monitoring dashboards powered by OSINT and human-intel. Integrated travel-risk tracking and crisis response workflows ensure clients receive timely evacuation, threat mitigation, and post-event analysis without maintaining in-house security.",Secure-comm app; OSINT-analytics; mobile-response coordination portal; crisis workflows,Multi sources,Quick Est GPT-o3
657,PDS Direct,pdsdirect.co.uk,60,"IT hardware buyers in education and public sectors face complex procurement frameworks and legacy vendors. PDS Direct’s e-commerce portal aggregates approved catalogues, automates tender-compliant ordering, and integrates with frameworks such as ESPO and CCS. Institutions gain transparent pricing, live stock, and automated invoicing—cutting days from purchase cycles and ensuring compliance without bespoke procurement builds.",Framework-compliant e-commerce; tender-logic engine; framework API connectors; automated invoicing,Multi sources,Quick Est GPT-o3
663,Hubpay,hubpay.ae,60,"Middle Eastern businesses face high FX costs and fragmented remittance corridors. Hubpay provides a single API and dashboard aggregating local payout partners, offering dynamic FX rates and forward hedging. Automated KYC/AML flows and real-time tracking ensure compliance, while multi-rail payouts reduce remittance fees by 30% for enterprises and marketplaces.",Aggregated payout API; dynamic FX engine; KYC/AML automation; tracking dashboard,Multi sources,Quick Est GPT-o3
673,Optimize Courier,optimize-courier.com,60,"Last-mile delivery fleets struggle with inefficient routing, manual tracking, and high fuel costs. Optimize Courier’s SaaS platform ingests parcel manifests, traffic data, and vehicle telematics to generate optimized daily routes. Real-time driver apps update for traffic or order changes, while customer-facing SMS tracking reduces call center inquiries. Analytics dashboards highlight dwell times and service failures, helping logistics managers raise on-time performance and cut mileage without replacing vehicles.",Dynamic route-optimization engine; telematics integration; driver mobile app; customer SMS API,Multi sources,Quick Est GPT-o3
