732,Sierra Interactive,sierrainteractive.com,100,"Real-estate brokers lose leads when IDX and CRM platforms are mis-configured or lack real-time updates. Sierra Interactive’s unified proptech suite combines responsive IDX websites, lead-routing automations, and transaction-management workflows under one dashboard. AI-driven nurture campaigns and analytics dashboards improve conversion and production consistency across agent teams—eliminating tech-stack sprawl and customization headaches.",IDX-CMS integrations; lead-routing engine; transaction workflow portal; AI nurture module,Multi sources,Quick Est GPT-o3
748,Imperative Logistics,imperativelogistics.com,100,"Plant managers often lack visibility into inbound-material arrivals, slowing production. Imperative Logistics offers a “virtual warehouse” solution that monitors supplier shipments and warehouse garnering via GPS/TMS-agnostic tracking. Anomaly alerts and predictive ETA recalculations feed MES, adjusting production schedules in real time. Integrated supplier portals and mobile proof-of-delivery streamline communications and reduce stockouts without overstocking buffer inventory.",GPS/TMS integration; predictive-ETA engine; MES scheduling API; supplier-portal dashboards,Multi sources,Quick Est GPT-o3
777,HNI Healthcare,hnihc.com,100,"Employers and health plans lack streamlined platforms for onsite occupational health, wellness screenings, and injury management. HNI Healthcare’s integrated clinic management system automates appointment booking, EMR documentation, and employer-portal reporting. Onsite check-in kiosks, telehealth follow-ups, and population-health analytics help HR optimize workforce health programs and reduce OSHA recordables—centralizing disparate services on one digital platform.",Clinic-management SaaS; EMR integration; telehealth follow-up; population-health analytics portal,Multi sources,Quick Est GPT-o3
831,Guideline.ai,guideline.ai,100,"HR teams find traditional benefits administration complex, manual, and error-prone. Guideline.ai’s automated 401(k) and benefits-enrollment platform integrates with payroll and HRIS, delivering real-time eligibility verification, e-signature, and compliance tracking. Predictive analytics optimize participant outcomes and employer match strategies. The result: frictionless enrollment, reduced administrative cost, and improved plan engagement—all from one API-driven interface.",Benefits-automation engine; payroll/HRIS connectors; e-signature workflows; predictive analytics module,Multi sources,Quick Est GPT-o3
845,BetterHealth Group,betterhealthgroup.com,100,"Global life-science companies require detailed patient and HCP insights to guide product launches and access strategies. BetterHealth Group’s proprietary panels of physicians and patients deliver real-time survey data, chart reviews, and patient-reported outcomes dashboards. AI-driven analytics identify unmet needs and treatment pathways, informing evidence-based commercial planning and improving launch success rates without custom market-research builds.",Proprietary panel platform; AI analytics engine; PRO dashboard; chart-review portal,Multi sources,Quick Est GPT-o3
857,Appcues,appcues.com,100,"Product teams struggle to onboard and engage users in-app without engineering cycles. Appcues’ no-code UX layer lets non-technical teams build interactive walkthroughs, tooltips, and surveys directly on live products. Behavioral analytics and A/B testing measure feature adoption and guide flow improvements, driving 30% lift in activation without touching code.",No-code UX overlay; in-app analytics; A/B testing framework; user-segmentation engine,Multi sources,Quick Est GPT-o3
859,BitTorrent,bittorrent.com,100,"Developers and content platforms need efficient peer-to-peer delivery for large files without central server cost. BitTorrent’s decentralized protocol and WebRTC-based SDK powers high-throughput, distributed file transfers across browsers and native apps. Integrated bandwidth-optimization and swarm-management analytics ensure reliability and reduce CDN egress by up to 70%, enabling scalable large-asset delivery with minimal infra spend.",P2P transfer protocol; WebRTC SDK; swarm-management analytics; bandwidth-optimization engine,Multi sources,Quick Est GPT-o3
883,Environics Analytics,environicsanalytics.com,100,"Marketers and planners need granular consumer and location data to optimize campaigns and site selection, yet disparate datasets make analysis slow. Environics Analytics provides harmonized demographic, psychographic, and mobility insights via API and mapping tools. Custom segmentation builders and scenario-modeling dashboards let users visualize trade-area fits and forecast market potential—accelerating go-to-market decisions without long data-sourcing cycles.",Harmonized consumer data API; GIS mapping engine; segmentation builder; scenario modeling dashboards,Multi sources,Quick Est GPT-o3
886,OutreachHealth,outreachhealth.com,100,"ABMs need to orchestrate multi-touch campaigns across digital ads, emails, and events without losing data continuity. OutreachHealth’s healthcare-focused engagement platform integrates CRM, email-marketing, and paid channels, ensuring compliance with HIPAA and HCP-targeting rules. Real-time analytics tie activities to referral outcomes, enabling teams to refine messaging and channel mix continuously—driving higher patient acquisition and retention without fragmented toolsets.",CRM connector; HIPAA-compliant marketing engine; multi-channel analytics; referral-tracking workflows,Multi sources,Quick Est GPT-o3
899,Grow Therapy,growtherapy.com,100,"Employers and payers struggle to provide accessible mental-health care due to provider shortages and fragmented referral processes. Grow Therapy’s telehealth platform connects clients to licensed clinicians via video, matching based on specialty, insurance, and availability. Integrated scheduling, secure messaging, and outcomes tracking streamline care delivery, while an API ecosystem embeds therapy access into EAPs and health plans—improving utilization and reducing wait times without complex vendor integrations.",Telehealth portal; clinician-matching engine; secure messaging; outcomes dashboard,Multi sources,Quick Est GPT-o3
907,Briq,briq.com,100,"Construction finance teams struggle with manual budgeting, forecasting, and cost tracking in spreadsheets. Briq’s AI-powered FP&A platform ingests ERP and project-management data, then auto-generates forecasts, variance analyses, and cashflow models. Scenario modeling and real-time dashboards let PMs and CFOs optimize project margins and cash buffers—delivering dynamic financial insights without building BI reports from scratch.",AI FP&A engine; ERP integrations; variance analysis; real-time dashboards,Multi sources,Quick Est GPT-o3
912,VoltServer,voltserver.com,100,"Data centers, hospitals, and industrial sites need safe, efficient DC power distribution but face high copper costs and safety risks. VoltServer’s Digital Electricity™ system delivers segmented DC power over common conductors with real-time safety monitoring and energy-management integration. Modular power zones and software-controlled circuit protection reduce wiring complexity and fault impact—enhancing reliability and lowering infrastructure costs compared to traditional AC distribution.",Digital Electricity™ hardware; software safety monitoring; energy-management APIs; modular power zones,Multi sources,Quick Est GPT-o3
944,Shoreline Sightseeing,shorelinesightseeing.com,100,"Tourists in Chicago seek unique city-view experiences but face seasonal scheduling and booking management issues. Shoreline Sightseeing’s online platform offers dynamic departure scheduling, ticket bundling, and mobile-ready boarding passes. Integrated channel management and yield-optimization algorithms maximize vessel utilization, while real-time weather and capacity alerts ensure safety and smooth operations—delivering memorable tours without overbooking or idle fleets.",Dynamic scheduling engine; yield-optimization algorithms; channel-manager; mobile-ticketing SDK,Multi sources,Quick Est GPT-o3
948,AFS,afs.net,100,"Manufacturers require rapid prototyping and short-run production but face long tool-up times and high setup costs. AFS’s digital manufacturing network connects clients to local CNC, casting, and additive manufacturing partners. Instant quoting, automated job allocation, and quality-assurance portals ensure parts meet specs, reducing lead times from weeks to days without capital expenditure on in-house tooling.",Digital quoting engine; distributed manufacturing network; QA-portal; job-allocation algorithms,Multi sources,Quick Est GPT-o3
961,Actionstep,actionstep.com,100,"Legal teams struggle with disjointed case management, billing, and document automation. Actionstep’s cloud-native practice-management platform unifies matter workflows, trust accounting, and e-billing in one configurable system. Built-in automation triggers (e.g., statute reminders, fee generation) and document-assembly templates reduce admin tasks, while real-time dashboards surface bottlenecks—delivering streamlined legal operations without multiple third-party integrations.",Workflow-automation engine; trust-accounting module; document-assembly; real-time dashboards,Multi sources,Quick Est GPT-o3
109,Northwest Arkansas National Airport (XNA),flyxna.com,102,"Families and Fortune 500 road-warriors in the Ozarks once burned four-plus hours driving to larger hubs, losing time and deals. XNA aggregates 26 nonstop routes and one-stop global itineraries in a compact, community-owned terminal 15 minutes from Bentonville. Ongoing $35 million concourse, baggage-handling and parking upgrades relieve peak-hour congestion, while a mobile FIDS app, CLEAR lanes and free Wi-Fi smooth curb-to-gate flow. By crossing the 1 million-enplanement mark in 2024, the airport now anchors regional growth, keeping travel spend, jobs and tourism close to home instead of leaking to Dallas or Kansas City.",Real-time FIDS & mobile alerts; TSA Pre✓/CLEAR biometrics; IoT baggage-tracking conveyor; LEED HVAC retrofits; route-planning analytics dashboard,Multi sources,Quick Est GPT-o3
498,ProMiles Software,promiles.com,120,"Interstate carriers lose profits to out-of-route miles, fuel-tax mis-filings and haz-mat permit delays. ProMiles ingests cab telemetry, FMCSA rules and network fuel prices, then builds legally compliant routes, auto-populates IFTA/IRP returns and predicts toll, fuel and carbon cost before the driver leaves the yard. Dispatch can compare “cheapest vs. fastest” in seconds, auditors click once to prove tax accuracy, and fleets recover hours per truck each month while slashing violations.",Regulatory-aware routing engine; real-time fuel-price & toll APIs; IFTA/IRP e-filing cloud; ELD/telematics connectors; carbon-impact calculator,Multi sources,Quick Est GPT-o3
517,7bridges,the7bridges.com,120,"Enterprises overspend 10-15 % on logistics. 7bridges’ AI platform standardises carrier invoices, simulates networks and auto-chooses optimal service, delivering double-digit savings and resilience without hiring analysts.","Data-ingest AI, scenario simulation, dynamic carrier routing API, PDF invoice OCR, self-serve BI",Multi sources,Quick Est GPT-o3
586,Acclaim Systems,acclaimsystems.com,120,"Mid-sized retailers lose visibility into omnichannel promotions and gift-card balances, leading to fraud and poor customer experience. Acclaim offers a cloud loyalty and gift-card platform that unifies reward-points programs, e-gift cards, and coupons under a single wallet. Real-time balance APIs and fraud-detection rules ensure seamless redemptions in-store or online, increasing redemption rates and protecting revenue.",Loyalty-wallet engine; real-time balance APIs; fraud-detection rules; omnichannel redemption portal,Multi sources,Quick Est GPT-o3
590,Trella Health,trellahealth.com,120,"Home-health and hospice providers lack actionable market and operational insights to optimize capacity and quality. Trella Health’s SaaS platform aggregates CMS claims, referral data, and patient outcomes, then applies predictive-analytics to recommend optimal patient mix, staffing levels, and visit frequency. Interactive dashboards and ROI calculators help providers grow profitably while maintaining clinical standards—reducing rehospitalizations and maximizing reimbursement.",Claims-data lake; predictive-analytics models; interactive provider dashboards; ROI calculator,Multi sources,Quick Est GPT-o3
606,Club El Nogal,clubelnogal.com,120,"Bogotá’s affluent expat and local families sought a private-club experience with authentic cultural programming and modern amenities. Club El Nogal blends membership-managed social, sports, and dining facilities with a custom mobile app for reservations, billing, and event alerts. Integrated KDS and POS systems optimize banquet workflows, while multilingual CRM segments members for targeted experiences—fostering community and driving non-dues revenue through curated lifestyle offerings.",Membership-CRM; event-reservation engine; KDS-POS integration; mobile guest-app,Multi sources,Quick Est GPT-o3
624,Clear Bank,clear.bank,120,"UK businesses encounter slow payments and limited real-time banking features from legacy banks. Clear Bank delivers an API-first clearing and settlement platform under an FCA license, offering real-time Faster Payments, Direct Debit and Open Banking connections. Embedded compliance, liquidity forecasting, and reconciliation workflows let fintechs and corporates embed banking services seamlessly, reducing reconciliation burdens and accelerating customer transactions.",API-first clearing rails; real-time payments engine; compliance workflows; reconciliation API,Multi sources,Quick Est GPT-o3
706,RadnTx,radntx.com,120,"Radiology practices and hospitals often grapple with radiologist shortages and delayed reads, impacting patient throughput. RadnTx’s teleradiology network connects imaging centers to a global pool of board‐certified radiologists via a HIPAA-secure cloud. Studies are uploaded in seconds, read within hours, and linked back to PACS automatically. Integrated quality-assurance workflows and AI-prescreening ensure accuracy and flag critical findings immediately, reducing turnaround times and keeping care on schedule without in-house hiring sprees.",HIPAA-secure cloud PACS; AI triage engine; global reading network; QA workflow portal,Multi sources,Quick Est GPT-o3
715,Everyday Loans UK,everyday-loans.co.uk,120,"UK consumers with subprime credit find high-cost short-term loans but lack transparent, regulated options. Everyday Loans offers FCA-regulated personal credit with clear fee structures, mobile-app underwriting, and automated affordability checks. Integrated Open Banking data speeds decisions, while repayment-nudges and hardship-support pathways reduce arrears without leaving customers over-leveraged.",Open Banking underwriting; affordability engine; mobile-app origination; automated repayment reminders,Multi sources,Quick Est GPT-o3
767,Crown Agents Bank,crownagentsbank.com,120,"NGOs and development agencies need local-currency project funding and risk-managed FX, but traditional banks lack global reach in emerging markets. Crown Agents Bank provides multicurrency bridge financing, pre-funded collection accounts, and embedded FX hedges via API. Their platform integrates KYC, transaction-monitoring, and project-reporting tools, letting organizations deploy capital and track spend in real time with minimal counterparty risk—accelerating impact projects.",Multicurrency API; FX-hedging engine; KYC/AML monitoring; project-reporting portal,Multi sources,Quick Est GPT-o3
836,ZeroAvia,zeroavia.com,120,"Regional airlines and airports seek zero-emission alternatives but face limited options for hydrogen-electric powertrains. ZeroAvia develops and deploys hydrogen-fuel-cell propulsion systems for 10–20 seat aircraft, enabling retrofit kits that maintain range and payload while slashing carbon emissions. Their modular test-bed integrations and certification support help operators accelerate entry into commercial hydrogen flights—unlocking sustainable regional air service.",Hydrogen fuel-cell powertrain; modular retrofit kits; test-bed integration; certification toolkit,Multi sources,Quick Est GPT-o3
862,FDH Aero,fdhaero.com,120,"Aircraft refurbishers and MROs struggle to manage parts, work orders, and logistics across disparate systems. FDH Aero’s cloud platform centralizes maintenance planning, parts-inventory management, and 3PL coordination with barcode scanning and mobile inspections. Automated compliance reporting (EASA/FAR) and predictive stock-replenishment reduce AOG events and inventory costs without custom ERP projects.",Maintenance-management SaaS; inventory barcode-scanning; compliance-reporting; predictive-replenishment,Multi sources,Quick Est GPT-o3
902,Fairfax Software,fairfaxsoftware.com,120,"Commercial insurers and self-insured companies lack flexible claims management tools that adapt to bespoke workflows. Fairfax Software’s low-code claims platform lets adjusters build custom processes, integrate third-party data, and automate subrogation and recovery. Dynamic dashboarding and ML-driven fraud alerts accelerate resolution and reduce leakage—delivering end-to-end claim handling without heavy vendor lock-in.",Low-code claims platform; third-party data integrations; ML fraud detection; dynamic dashboards,Multi sources,Quick Est GPT-o3
521,RPA Engineering,rpa.com,123,"Manufacturers scaling biotech and EV plants need multidisciplinary engineers fast. RPA delivers mechanical, controls and commissioning services, using BIM and digital twins to shorten build cycles and certify validation. LinkedIn","Multi-discipline CAD/BIM, digital-twin simulation, commissioning/validation suite, high-stress piping FEA, ISO 9001 PMO",Multi sources,Quick Est GPT-o3
645,Bite Investments,biteinvestments.com,15,"Tech startups lack unbiased venture advice and connections to growth capital. Bite Investments offers a curated deal-flow platform, due-diligence analytics, and mentor networks. Integrated term-sheet simulators and cap-table models help founders make informed choices, while a secure investor-portal accelerates rounds without over-reliance on personal networks.",Deal-flow marketplace; DD analytics; term-sheet simulator; cap-table modelling tool,Multi sources,Quick Est GPT-o3
714,MakeItRealPlay,makeitrealplay.com,15,"Universities and corporate L&D teams struggle to engage learners online with static video. MakeItRealPlay’s interactive-video platform embeds quizzes, branching scenarios, and live polls directly into content. Real-time engagement analytics and LMS-sync plugins surface knowledge gaps, while built-in gamification boosts completion rates. Clients transform passive courses into active learning experiences without custom dev.",Interactive-video SDK; branching scenario engine; real-time analytics; LMS integration,Multi sources,Quick Est GPT-o3
729,Sno-NSN,sno-nsn.gov,15,"Tribal communities lack centralized support for social services, education, and health programs. The Sno-NSN online portal aggregates resources, event calendars, and grant applications, while built-in secure messaging connects members to caseworkers. Multilingual support and offline data access ensure rural residents stay informed and engaged, strengthening community cohesion without costly custom IT builds.",Community portal CMS; secure messaging; multilingual UI; offline-data sync,Multi sources,Quick Est GPT-o3
752,Macking,macking.com,15,"SMBs need enterprise-grade floor-plan and user-behavior analytics but can’t afford complex BI tools. Macking’s lightweight SDK integrates into websites and mobile apps, capturing heatmaps, clickstreams, and session paths. Interactive dashboards and anomaly alerts help product teams optimize UX and conversion funnels without heavy data-science support.",Behavioral-analytics SDK; session-replay engine; anomaly-detection alerts; interactive dashboards,Multi sources,Quick Est GPT-o3
790,RYM Nutrition,rymnutrition.com,15,"Health-conscious consumers struggle to find supplements backed by transparent sourcing and efficacy data. RYM Nutrition’s DTC platform combines third-party lab verifications, batch-specific biomarker recommendations, and subscription management. AI-driven regimen personalization based on health inputs ensures efficacy, while integrated 3PL and auto-reorder workflows maintain continuity—boosting adherence and trust without treat-store guesswork.",Biomarker-driven AI recommendations; batch-verification API; subscription-engine; 3PL integration,Multi sources,Quick Est GPT-o3
110,Tillo,tillo.io,150,"Reward programs waste hours stitching hundreds of gift-card suppliers, each with separate contracts, formats and fraud risks. Tillo’s single “plug-and-go” API connects banks, HR apps and fintech wallets to 3,000+ global brands in real time, automating issuance, balance checks and settlement while machine-scanning orders for anomalies. Partners launch cashback, employee-perk or card-swap features in days, boost engagement and unlock new revenue without inventory or breakage headaches. Advanced reporting reconciles every code to the penny, turning gift cards from an operational drag into a scalable growth lever.",Gift-card REST API; automated KYC/fraud screening; multi-currency catalog; webhook real-time balances; embedded analytics portal,Multi sources,Quick Est GPT-o3
118,Decoded Advertising,decodedadvertising.com,150,"CMOs crave brand storytelling that also converts, yet agency silos split creative from performance. Decoded unites strategists, designers, media buyers and data scientists in one P&L, delivering full-funnel campaigns that win Cannes Lions and beat ROAS targets. Dynamic creative optimization and commerce analytics iterate assets hourly, not quarterly, turning emotional narratives into measurable sales for Visa, T-Mobile and WW.",Dynamic creative optimization stack; cross-channel econometric model; proprietary “DecodedOS” media engine; shoppable video; in-house production studio,Multi sources,Quick Est GPT-o3
127,Agilence,agilenceinc.com,150,"Retailers lose 1–3% of sales to shrink. Agilence unifies POS, e-commerce, CCTV and RFID data, applying anomaly algorithms to flag sweethearting, return fraud and inventory loss within minutes. Centralized cases and mobile audits let LP teams act fast, recouping millions and boosting on-shelf availability.",Loss-prevention analytics SaaS; RFID shrink module; AI pattern detection; integrated case management; mobile store-audit app,Multi sources,Quick Est GPT-o3
515,M/A/R/C Research,marcresearch.com,150,"Brands risk mis-kicking campaigns without fast consumer insight. M/A/R/C’s agile qual-quant platform recruits panels, runs mobile diaries and delivers dashboards in days, powering data-driven product and comms decisions. LinkedIn","Rapid qual-quant stack, mobile ethnography app, online communities, conjoint & TURF analytics, live KPI portal",Multi sources,Quick Est GPT-o3
602,Sosandar,sosandar.com,150,"Mid-market fashion retailers struggle with inventory glut and poor online conversion. Sosandar’s AI-driven styling and size-prediction engine personalizes product recommendations and fit guidance, reducing returns by 40%. A unified order-fulfillment system and responsive design optimize mobile checkout, while real-time merchandising dashboards help teams replenish best-sellers and phase-out slow stock—turning season-end clearance into profitable events.",AI size-predictor; personalized-recommendation engine; OMS-WMS integration; real-time merch-dashboards,Multi sources,Quick Est GPT-o3
609,SRMR Colorado,smrmc.com,150,"Military and federal facilities need rapid repair of medical and mechanical repro services that private vendors won’t touch. SRMR Colorado offers 24/7 on-base machining, medical-device servicing, and emergency-parts logistics with cleared personnel and mobile labs. Their rapid-response workflows and inventory-visibility portal reduce downtime for mission-critical platforms, ensuring readiness without lengthy contracting.",Mobile CNC labs; cleared-personnel dispatch; inventory-visibility portal; emergency-logistics workflows,Multi sources,Quick Est GPT-o3
631,Autoprotect Group,autoprotectgroup.co.uk,150,"Car dealers and leasing companies lose revenue when aftermarket service contracts and warranties are under-sold or mis-priced. Autoprotect’s SaaS platform automates contract quoting, underwriting, and claims administration, integrating OEM parts data and telematics-triggered maintenance alerts. Dealers increase attach-rates by 40% and customers get transparent coverage tracking without back-office headaches.",Underwriting-rules engine; telematics integration; claims-workflow portal; OEM-data API,Multi sources,Quick Est GPT-o3
637,Wild Water Group,wildwatergroup.com,150,"Waterpark and family-entertainment operators face safety, queue and maintenance challenges. Wild Water Group designs, installs, and services modular water-attraction systems with IoT sensors for flow, load-monitoring, and predictive maintenance. Real-time ride-status dashboards and mobile operator apps minimize downtime, keeping parks safe and guest satisfaction high.",IoT ride-monitoring; predictive-maintenance engine; modular-attraction design; operator app,Multi sources,Quick Est GPT-o3
