806,Elliptic,elliptic.co,200,"Financial institutions and exchanges face rising crypto-financial-crime risks but lack crypto-native AML tools. Elliptic’s blockchain-analytics platform ingests transaction data across 100+ blockchains, applies ML risk-scoring, and maps addresses to illicit entities. Integrated alert-workflows and case-management modules automate investigations and SAR filings, enabling compliance teams to monitor virtual-asset flows at scale without custom blockchain expertise.",Blockchain-transaction API; ML-risk-scoring engine; entity-mapping graph; case-management portal,Multi sources,Quick Est GPT-o3
813,Igloo Software,igloosoftware.com,200,"Large organizations lack flexible and governed digital-workspace solutions for intranets, knowledge hubs, and engagement portals. Igloo’s cloud-based Digital Experience Platform offers modular apps—communities, file-sharing, and workflow automation—with low-code config and granular permission controls. Integrated analytics monitor adoption and content health, enabling IT to deliver modern employee experiences without custom dev.",DXP modular apps; low-code configurator; permission-engine; analytics console,Multi sources,Quick Est GPT-o3
832,Allica Bank,allica.bank,200,"UK SMEs need relationship banking that understands their growth plans, yet many face impersonal service and opaque lending. Allica Bank combines dedicated business bankers with a digital platform offering real-time cashflow forecasting, invoice finance, and tailored lending products. AI-driven risk models and automated underwriting speed decisions, while bankers provide strategic advice—delivering personal relationships and high-touch service with fintech-grade convenience.",Digital banking platform; cashflow forecasting; invoice-finance API; automated underwriting engine,Multi sources,Quick Est GPT-o3
840,GSMA,gsma.com,200,"Mobile operators and ecosystem partners need coordinated industry standards, policy advocacy, and research on connectivity and 5G/6G evolution. GSMA convenes working groups, publishes intelligence reports, and operates global events to align roadmap development. Its intelligence platforms integrate operator data and third-party analytics, giving stakeholders actionable insights to shape spectrum policy, roaming, and IoT strategies—accelerating global mobile progress.",Intelligence portal; operator-data integration; policy-advocacy networks; event management platform,Multi sources,Quick Est GPT-o3
847,Snagajob,snagajob.com,200,"Hourly-work employers struggle to find, engage, and retain shift-based workers via generic job boards. Snagajob’s specialized hourly-work marketplace uses dynamic matching algorithms based on availability, skills, and location. Integrated scheduling, time-clock, and shift-reminder tools reduce no-shows, while employer-branded candidate portals strengthen engagement—delivering a full-cycle hourly staffing solution.",Matching algorithm; in-app scheduling; time-clock integration; shift-reminder engine,Multi sources,Quick Est GPT-o3
856,Welch Group UK,welchgroup.co.uk,200,"Facilities and construction projects often face costly downtime when mechanical seals, hoses, and fittings fail. Welch Group UK supplies engineered fluid- and motion-control components—seals, couplings, and bearings—paired with rapid CAD-backed specification and same-day logistics. Their e-catalog API drives accurate BOMs, while on-site support and predictive-maintenance analytics reduce mean-time-to-replace by 40%, keeping critical systems running without overstocking spare parts.",CAD-driven selection engine; e-catalog API; predictive-maintenance analytics; rapid delivery workflows,Multi sources,Quick Est GPT-o3
865,Empyrean Solutions,empyreansolutions.com,200,"HR leaders need centralized tools for benefits administration, open enrollment, and carrier connectivity. Empyrean’s cloud benefits-platform integrates with carriers via SFTP/API, automates enrollment workflows, and offers employee-self-service. Tiered analytics on participation and cost-savings, plus compliance dashboards, reduce manual reconciliation and improve benefits ROI without costly custom integrations or brokerage dependency.",Carrier-connect APIs; enrollment-workflow engine; self-service portal; ROI analytics dashboards,Multi sources,Quick Est GPT-o3
876,Shippo,shippo.com,200,"E-commerce merchants face fragmented shipping rates and manual label creation across carriers. Shippo’s multi-carrier API and dashboard aggregate real-time rates, automate label generation, and handle customs documentation. Integrated tracking webhooks and returns-portal widgets streamline customer notifications and reverse logistics—reducing shipping costs by up to 20% and saving operations teams hours per week without building custom integrations.",Multi-carrier rate API; label-generation engine; tracking webhooks; returns-portal SDK,Multi sources,Quick Est GPT-o3
881,Impartner,impartner.com,200,"Channel organizations face low partner engagement and misaligned goals due to scattered PRM tools. Impartner’s PRM platform centralizes deal registration, MDF management, and partner training in one portal. Integrated gamification and AI-powered channel-health analytics drive adoption and surface at-risk partners early. Automated workflow engines enforce program compliance and accelerate partner onboarding—boosting channel revenue without custom portal development.",PRM workflow engine; MDF-management module; gamification layer; channel-health analytics dashboard,Multi sources,Quick Est GPT-o3
914,GridPoint,gridpoint.com,200,"Commercial buildings lack granular energy and operational insights, relying on utility bills for performance metrics. GridPoint’s IoT platform installs submeter sensors and gateway controls to monitor HVAC, lighting, and plug loads in real time. AI-driven analytics recommend efficiency measures and fault detection alerts, while automated control loops optimize setpoints—delivering energy savings, enhanced comfort, and predictive maintenance without major retrofits.",IoT submetering; gateway control; AI energy analytics; automated control loops,Multi sources,Quick Est GPT-o3
927,HYTORC,hytorc.com,200,"Industrial maintenance teams need precise, repeatable bolting solutions to prevent equipment failures. HYTORC’s hydraulic and electric torque tools, combined with digital torque-data logging, ensure accurate joint assembly. Bluetooth-enabled tool controllers and cloud dashboards store bolting sequences, alert on out-of-tolerance readings, and integrate with CMMS—reducing flange leaks and downtime without manual record-keeping.",Bluetooth torque controllers; digital data logging; CMMS APIs; bolting-sequence dashboards,Multi sources,Quick Est GPT-o3
947,Gas South,gassouth.com,200,"Homeowners and businesses need affordable, transparent natural-gas pricing but face opaque rate structures. Gas South’s digital platform offers real-time usage monitoring, predictive-billing forecasts, and paperless enrollment. AI-driven consumption alerts and rebate dashboards empower customers to optimize usage, while integrated customer-service chatbots handle outages and billing questions—reducing support calls and improving satisfaction without legacy system overload.",Usage-monitoring IoT; predictive-billing analytics; chatbot integration; rebate-dashboard,Multi sources,Quick Est GPT-o3
963,Neighborly Software,neighborlysoftware.com,200,"Home-service franchises struggle to standardize lead-generation, dispatch, and customer follow-up across multi-unit operations. Neighborly Software’s plumbing, HVAC, and electrical franchise platform centralizes calls, schedules field technicians, and automates customer-feedback requests. Real-time job-status tracking and inventory-management modules ensure consistent service delivery and optimized parts usage—improving KPI visibility and customer satisfaction across hundreds of locations.",Call/distribution center software; mobile dispatch app; customer-feedback automation; inventory module,Multi sources,Quick Est GPT-o3
500,NPO 2,npo2.com,200,"Dutch viewers wanting in-depth journalism and culture were scattered across pay-TV and social feeds. Public broadcaster NPO 2 curates documentaries, arts and investigative news with sign-language and HbbTV accessibility, streaming live and on-demand free of charge. Personalised watch-lists and AI subtitle translation widen reach, keeping PSB relevance in the SVOD era.","Cloud OTT playout, HbbTV/Hybrid-TV apps, recommendation engine, dynamic ad-insertion, AI live-caption pipeline",Multi sources,Quick Est GPT-o3
785,HSBC,hsbc.com,"220,000","Global corporations need seamless cross-border payments, trade finance, and liquidity management but face fragmented systems and compliance burdens. HSBC’s global network offers real-time FX, SWIFT, and trade-finance platforms integrated with AI-driven sanctions screening and KYC. Clients use centralized dashboards for cash forecasting, automated documentary credit workflows, and risk-hedging tools—reducing manual reconciliation, accelerating working capital, and ensuring regulatory compliance across 64 markets.",Real-time FX engines; AI sanctions screening; SWIFT APIs; trade-finance workflow automation,Multi sources,Quick Est GPT-o3
503,Kallidus,kallidus.com,222,"HR teams juggle LMS, performance and hiring tools. Kallidus unifies learning, reviews, skills and applicant tracking so people teams design journeys once and surface them everywhere—cutting admin 50 % and boosting compliance. Embedded analytics prove ROI to the board.","Learn LMS cloud, Perform 360-feedback, Sapling HRIS APIs, skills-graph engine, PowerBI embedded dashboards",Multi sources,Quick Est GPT-o3
509,CafeX,cafex.com,25,"Banks and insurers need secure video co-browse inside apps. CafeX embeds WebRTC voice/chat, shares documents live and records transactions for compliance—upping conversion and CSAT without branch visits.","WebRTC SDK, in-session e-signature, AI call-summaries, Salesforce/MS Teams integration, ISO 27001 cloud",Multi sources,Quick Est GPT-o3
592,Players Health,playershealth.com,25,"Sports teams and athletes juggle injury prevention and rehab across disconnected tools, risking downtime. Players Health’s platform integrates movement-screening data, wearable metrics, and EMR notes, applying AI to flag injury-risk patterns. Integrated care-pathway modules guide strength, mobility, and recovery protocols, reducing time-lost and insurance costs without adding therapists.",Wearable-data integration; AI risk-analytics; integrated care-pathway modules; EMR API,Multi sources,Quick Est GPT-o3
608,MASM,masm.mw,25,"Malawian retailers lack local marketing expertise and struggle to make brand-loyalty programs work in emerging markets. MASM partners with FMCG brands to run in-market promotions, field-surveys, and loyalty apps on cost-effective mobile networks. Their local-agent telemetry and dashboard provide real-time ROI on trade-spend, turning manual distributor schemes into data-driven programs that drive market share in under-penetrated geographies.",Mobile-network SMS/USSD integration; field-survey app; loyalty program engine; ROI-dashboard,Multi sources,Quick Est GPT-o3
653,engprod,engprod.com,25,"Product teams struggle to deliver reliable features because engineering work isn’t tracked against user outcomes. EngProd’s platform connects JIRA, Git, and analytics pipelines to visualize cycle time, error rate, and feature adoption in real time. AI-driven runbooks suggest test suites and deployment guards, reducing outages by 40%, while outcome dashboards tie releases to business metrics—helping leaders balance velocity and stability without manual reporting.",DevOps metric pipelines; AI runbook recommender; real-time outcome dashboards,Multi sources,Quick Est GPT-o3
676,WoundTech,woundtech.net,25,"Chronic-wound clinics face high rates of infection and healing delays due to inconsistent documentation and dressing selection. WoundTech’s digital image-capture app, integrated with AI-driven tissue analysis, automates ulcer classification and recommends optimal dressings based on clinical guidelines. Care teams collaborate in a shared EHR-agnostic portal, reducing healing times and dressing waste while improving reimbursement capture.",AI tissue-analysis; image-capture mobile app; EHR-agnostic portal; decision-support engine,Multi sources,Quick Est GPT-o3
690,KodyPay,kodypay.com,25,"SMBs and freelancers struggle with invoicing delays and inconsistent cash flow when chasing payments. KodyPay embeds “Pay Now” and installment-plan buttons into invoices, powered by instant credit decisions and automated reconciliation. Clients get 100% of invoiced value upfront while buyers pay over time; real-time tracking and dunning automations maintain healthy AR days without adding headcount. The platform integrates with top accounting systems to keep books balanced automatically.",Embedded-pay APIs; instant-credit decisioning; AR automation; accounting-system connectors,Multi sources,Quick Est GPT-o3
728,VetDef,vetdef.co.uk,25,"UK veterans face fragmented housing, health, and benefits services post-deployment. VetDef’s network of partner NGOs and case-managers uses a CRM-driven portal to coordinate housing grants, mental-health referrals, and benefits claims. Automated eligibility checks, progress tracking, and peer-support forums ensure timely interventions and holistic care—improving veterans’ wellbeing without the bureaucratic maze.",CRM portal; eligibility-engine; case-management workflows; peer-support platform,Multi sources,Quick Est GPT-o3
757,SucFin,sucfin.com,25,"CFOs of innovative businesses need funding quickly but face lengthy bank processes. SucFin’s digital invoice-financing platform offers same-day approval, dynamic-discount modeling, and automatic repayments when customers pay. Integrated accounting connectors pull AR data, while risk-based pricing engines adjust rates to client performance—providing flexible liquidity without high-collateral requirements.",Invoice-financing engine; accounting-connector API; dynamic-discount model; auto-repayment workflows,Multi sources,Quick Est GPT-o3
789,EV UK,ev.uk,25,"Fleet operators transitioning to electric vehicles face charger network fragmentation and billing complexity. EV UK’s roaming platform aggregates charge-point operators, normalizes tariffs, and provides a single RFID/app interface. Real-time availability, dynamic reservation, and billing APIs simplify operations, while backend energy-forecasting helps fleets plan charging schedules cost-effectively—accelerating EV adoption without multiple vendor contracts.",Charge-point-roaming hub; dynamic billing APIs; real-time availability engine; energy-forecast analytics,Multi sources,Quick Est GPT-o3
796,AnchorHarvey,anchorharvey.com,25,"Brands seeking sustainable packaging struggle to find suppliers that combine compostable materials and design flexibility. AnchorHarvey’s digital marketplace matches customers to vetted eco-packaging suppliers, provides 3D mockups, and integrates order workflows via API. Real-time lead-time and cost comparisons help marketing teams meet sustainability goals without long RFP cycles or quality risks.",Marketplace matching engine; 3D mockup viewer; supplier-API order integration; sustainability scoring,Multi sources,Quick Est GPT-o3
838,Tobin Scientific,tobinscientific.com,25,"Laboratories conducting chemical trace analysis and environmental testing need turnkey GC-MS and LC-MS services but lack in-house expertise. Tobin Scientific offers ISO/IEC-accredited sample prep, method development, and data interpretation under one roof. Their digital portal provides electronic chain-of-custody, real-time run metrics, and customizable reporting templates—enabling organizations to outsource specialized analyses confidently without building expensive instrumentation labs.",ISO/IEC-accredited workflows; sample-prep automation; digital chain-of-custody; reporting portal,Multi sources,Quick Est GPT-o3
877,PartSnap,partsnap.io,25,"Manufacturers and MROs need rapid access to accurate CAD data for part identification and procurement. PartSnap’s mobile app auto-recognizes parts via image-to-CAD search, linking to supplier catalogs and procurement systems. Built-in quality checks ensure correct part numbers, while API integrations automate order workflows—eliminating weeks of manual drawing review and reducing maintenance downtime.",Image-to-CAD AI search; supplier-catalog API; procurement workflow automation,Multi sources,Quick Est GPT-o3
905,Leap Academy,leapacademy.com,25,"Schools and training centers need flexible online learning tools but face rigid LMS offerings. Leap Academy’s adaptive-learning platform provides personalized pathways, competency-based assessments, and real-time student analytics. Teachers create modules with drag-and-drop components, while integrated parent/student portals streamline communication and progress tracking—delivering modern learning experiences without heavy IT implementation.",Adaptive-learning engine; drag-and-drop course builder; competency analytics; portal integrations,Multi sources,Quick Est GPT-o3
965,RethinkFirst,rethinkfirst.com,25,"Small businesses and non-profits need affordable strategic and digital planning but lack access to consultancy expertise. RethinkFirst provides on-demand fractional CMO and CTO services—road-mapping, brand development, and tech-stack advisory—via a membership model. Interactive workshops, KPI-alignment frameworks, and ROI-tracking dashboards help organizations sanity-check plans and execute growth initiatives without full-time overhead.",Fractional-executive platform; workshop facilitation tools; KPI dashboards; ROI tracking engine,Multi sources,Quick Est GPT-o3
745,Lufthansa Technik (LTN),ltn.aero,"25,000","Airlines face high maintenance costs and unscheduled downtime due to complex aircraft systems. Lufthansa Technik offers MRO, component repair, and on-condition monitoring via its AVIATAR digital platform. Real-time health-data ingestion from sensors enables predictive maintenance, optimizing line and base checks. Integrated parts logistics and e-engineering tools reduce AOG events, while analytics dashboards drive continuous reliability improvements—keeping fleets airborne with lower maintenance spend.",AVIATAR IoT platform; predictive-maintenance analytics; digital twin models; parts-logistics engine,Multi sources,Quick Est GPT-o3
750,LSEG,lseg.com,"25,000","Financial institutions require reliable market data, analytics, and clearing services across asset classes. LSEG fuses real-time data feeds, quantitative models, and risk-management tools with clearing and post-trade workflows on a single platform. Integrated ESG datasets and AI-driven alerts help clients meet compliance and investment mandates, while low-latency delivery ensures timely decision-making in trading, risk, and research.",Real-time market feeds; quantitative analytics; clearing APIs; ESG data modules; risk-alert engine,Multi sources,Quick Est GPT-o3
111,MYCOM OSI,mycom.com,250,"Mobile operators bleed ARPU when 5G slices, VoLTE and fiber services degrade before NOC teams spot issues. MYCOM OSI’s assurance platform ingests billions of network KPIs per day, applies AI root-cause and topology analytics, and auto-orchestrates fixes across RAN, transport and core. CSPs cut churn, hit SLA targets and defer costly over-builds, all from a single cloud-native pane. The result: higher customer satisfaction and faster time-to-revenue for new services without ballooning ops headcount.",Service-experience assurance suite; generative-AI “Ask Your Network” bot; closed-loop automation; multi-cloud data-lakehouse; 5G slice analytics,Multi sources,Quick Est GPT-o3
770,Autolus Therapeutics,autolus.com,250,"Cancer patients refractory to standard therapies need next-gen cell treatments. Autolus engineers autologous T-cell therapies with precision-gene editing and modular CAR programming to target multiple antigens and overcome tumor escape. Their automated manufacturing suites and digital batch-record systems ensure scalable, GMP-compliant production. Integrated biomarker analytics accelerate dose optimization and patient stratification—bringing personalized cell therapies to clinic efficiently.",Precision gene-editing platform; modular CAR design; automated GMP manufacturing; biomarker analytics,Multi sources,Quick Est GPT-o3
901,CDS.net,cds.net,250,"Hospitality and M&E venues struggle with disparate F&B, POS, and ticketing systems, leading to siloed data and poor guest experiences. CDS.net’s unified hospitality platform unifies POS, event-management, and membership modules under one UI. Real-time reporting on F&B sales, event attendance, and CRM data helps operators optimize staffing, pricing, and promotions—improving revenue and guest satisfaction without multiple vendors.",Unified POS/event-management; membership CRM; real-time reporting,Multi sources,Quick Est GPT-o3
117,M3 USA,usa.m3.com,266,"Pharma brands struggle to reach verified physicians at scale without breaching privacy rules. M3 USA’s network ties 2.5 million HCPs to targeted education, research and recruitment portals. Predictive engagement scores route content across email, webcasts and proprietary communities, proving script-lift and ROI while abiding by AMA and GDPR guidelines. The platform bridges shrinking rep access and fragmented digital touchpoints, accelerating evidence-based care adoption.",HCP identity graph; GDPR-safe messaging engine; real-time script-lift attribution; virtual CME studio; panel-based market-research API,Multi sources,Quick Est GPT-o3
124,Sugar Mountain,sugarmtn.net,280,"Consumers crave clean-label food but distrust industrial brands. Sugar Mountain incubates Beecher’s Handmade Cheese, Mishima Reserve Wagyu and fast-casual pasta bars, controlling supply chain “from cow to counter.” On-site glass-walled vats, wagyu breeding and zero-additive recipes build transparency, letting diners trade up without chemicals.",Open-kitchen production; proprietary Wagyu genetics; additive-free formulations; multi-brand e-commerce; cold-chain DTC logistics,Multi sources,Quick Est GPT-o3
929,Brighthouse Financial,brighthousefinancial.com,"3,500","Pre-retirees need guaranteed-income solutions beyond traditional annuities but face opaque fees. Brighthouse Financial offers fixed and indexed annuity products with digital illustration tools, real-time payout calculators, and simplified e-application workflows. Embedded compliance-check engines and financial-planning APIs integrate with advisor CRM, ensuring suitability and accelerating issuance—delivering secure retirement income solutions seamlessly.",Annuity-illustration API; payout-calculator engine; e-application workflows; compliance-check module,Multi sources,Quick Est GPT-o3
946,Hughes,hughes.com,"3,500","Rural and enterprise customers lack reliable, high-throughput broadband where fiber isn’t available. Hughes provides managed satellite and hybrid networks with on-prem gateways, dynamic link-optimization, and SLA-backed performance. Integrated network-management portals and predictive-maintenance alerts ensure uptime for retail, oil & gas, and government clients—delivering connectivity in the hardest-to-reach areas without multiple vendor contracts.",Satellite-managed network; SD-WAN integration; link-optimization; network-management portal,Multi sources,Quick Est GPT-o3
130,M+R (M & R SS),mrss.com,30,"Non-profits fighting climate, rights and health crises struggle to raise funds amid inbox fatigue. M+R’s 100-strong strategists craft data-tested emails, social-ads and grassroots campaigns that boost ROI and mobilize supporters. Benchmarks, A/B labs and an in-house union ensure ethical, evidence-based comms that “raise money & raise hell” for progressive causes.",Multi-variant email optimizer; influencer-led TikTok studio; Tableau donation-lift dashboards; rapid-response SMS tool; annual nonprofit benchmarks,Multi sources,Quick Est GPT-o3
504,Apptix.io,apptx.io,30,"Start-ups need enterprise-grade mobile apps without in-house squads. Apptix’s 40-engineer studio delivers React-Native, Flutter and IoT builds plus DevSecOps and QA automation on a fixed-bid sprint model—launching MVPs in weeks, not quarters.","React-Native/Flutter stacks, Azure/GCP CI-CD, automated test pipelines, UX prototyping lab, GPT content-assist",Multi sources,Quick Est GPT-o3
582,Relanto,relanto.ai,30,"Enterprise IT teams lose productivity to fragmented alerting and manual on-call rotations. Relanto’s AI-driven incident orchestration ingests monitoring-tool events, applies root-cause grouping, and automatically notifies the right engineers via chat-ops. Predictive analytics forecast incident spikes, enabling pre-emptive remediation. Post-mortem analytics identify MTTA/MTTR trends, helping DevOps improve reliability without building custom ops dashboards.",AI incident-grouping; predictive-analytics engine; chat-ops integrations; on-call automation workflows,Multi sources,Quick Est GPT-o3
601,Value City NJ,valuecitynj.com,30,"New Jersey families seeking affordable furniture faced opaque outlet auctions and inconsistent quality. Value City NJ aggregates overstock, returns, and display models into a warehouse showroom, using an in-house grading system and dynamic-pricing engine to ensure transparent deals. Integrated POS and online inventory sync let shoppers reserve items digitally and pick up within hours, turning surplus logistics into a community retail win-win.",Dynamic-pricing engine; grade-index system; POS-ecommerce sync; warehouse CMS,Multi sources,Quick Est GPT-o3
